INITIALIZATION
CREATE TABLE T_NULL(ID INT NOT NULL, NUM INT NULL, PRICE FLOAT NULL, BIRTHDAY DATE NULL, NAME CHAR(10) NULL);
SUCCESS
CREATE TABLE T_NULL2(ID INT NOT NULL, NUM INT NULL, NOTE CHAR(10) NULL);
SUCCESS
CREATE INDEX IDX_NUM ON T_NULL(NUM);
SUCCESS

1. BASIC INSERTS
INSERT INTO T_NULL VALUES (1, 10, 9.9, '2021-01-01', 'A');
SUCCESS
INSERT INTO T_NULL VALUES (2, NULL, 8.8, '2020-02-02', 'B');
SUCCESS
INSERT INTO T_NULL VALUES (3, 30, NULL, NULL, 'C');
SUCCESS
INSERT INTO T_NULL VALUES (4, 40, 4.4, '2019-03-03', NULL);
SUCCESS
INSERT INTO T_NULL VALUES (5, NULL, NULL, NULL, NULL);
SUCCESS
INSERT INTO T_NULL VALUES (6, 0, 0.0, '2000-01-01', 'ZERO');
SUCCESS
INSERT INTO T_NULL VALUES (7, 5, 1.5, NULL, 'NEG');
SUCCESS

1.1 INSERTS INTO SECOND TABLE FOR CROSS-TABLE TESTS
INSERT INTO T_NULL2 VALUES (1, 10, 'MATCH');
SUCCESS
INSERT INTO T_NULL2 VALUES (2, NULL, 'NULLNUM');
SUCCESS
INSERT INTO T_NULL2 VALUES (3, 50, 'NOMATCH');
SUCCESS

2. SELECT WHOLE TABLE
SELECT * FROM T_NULL;
1 | 10 | 9.9 | 2021-01-01 | A
2 | NULL | 8.8 | 2020-02-02 | B
3 | 30 | NULL | NULL | C
4 | 40 | 4.4 | 2019-03-03 | NULL
5 | NULL | NULL | NULL | NULL
6 | 0 | 0 | 2000-01-01 | ZERO
7 | 5 | 1.5 | NULL | NEG
ID | NUM | PRICE | BIRTHDAY | NAME

3. CONSTANT VS NULL COMPARISONS
-- THESE ARE LOGICAL CHECKS; EXPECTED BEHAVIOR: IS NULL/IS NOT NULL EVALUATED CORRECTLY
SELECT * FROM T_NULL WHERE 1 IS NULL;
ID | NUM | PRICE | BIRTHDAY | NAME
SELECT * FROM T_NULL WHERE 1 IS NOT NULL;
1 | 10 | 9.9 | 2021-01-01 | A
2 | NULL | 8.8 | 2020-02-02 | B
3 | 30 | NULL | NULL | C
4 | 40 | 4.4 | 2019-03-03 | NULL
5 | NULL | NULL | NULL | NULL
6 | 0 | 0 | 2000-01-01 | ZERO
7 | 5 | 1.5 | NULL | NEG
ID | NUM | PRICE | BIRTHDAY | NAME
SELECT * FROM T_NULL WHERE NULL IS NULL;
1 | 10 | 9.9 | 2021-01-01 | A
2 | NULL | 8.8 | 2020-02-02 | B
3 | 30 | NULL | NULL | C
4 | 40 | 4.4 | 2019-03-03 | NULL
5 | NULL | NULL | NULL | NULL
6 | 0 | 0 | 2000-01-01 | ZERO
7 | 5 | 1.5 | NULL | NEG
ID | NUM | PRICE | BIRTHDAY | NAME
SELECT * FROM T_NULL WHERE NULL IS NOT NULL;
ID | NUM | PRICE | BIRTHDAY | NAME
SELECT * FROM T_NULL WHERE NULL = 1;
ID | NUM | PRICE | BIRTHDAY | NAME
SELECT * FROM T_NULL WHERE 1 = NULL;
ID | NUM | PRICE | BIRTHDAY | NAME
SELECT * FROM T_NULL WHERE NULL <> 1;
ID | NUM | PRICE | BIRTHDAY | NAME
SELECT * FROM T_NULL WHERE 1 <> NULL;
ID | NUM | PRICE | BIRTHDAY | NAME
SELECT * FROM T_NULL WHERE NULL > 1;
ID | NUM | PRICE | BIRTHDAY | NAME
SELECT * FROM T_NULL WHERE 1 > NULL;
ID | NUM | PRICE | BIRTHDAY | NAME

4. COLUMN IS NULL / IS NOT NULL
SELECT * FROM T_NULL WHERE NUM IS NULL;
2 | NULL | 8.8 | 2020-02-02 | B
5 | NULL | NULL | NULL | NULL
ID | NUM | PRICE | BIRTHDAY | NAME
SELECT * FROM T_NULL WHERE NUM IS NOT NULL;
1 | 10 | 9.9 | 2021-01-01 | A
3 | 30 | NULL | NULL | C
4 | 40 | 4.4 | 2019-03-03 | NULL
6 | 0 | 0 | 2000-01-01 | ZERO
7 | 5 | 1.5 | NULL | NEG
ID | NUM | PRICE | BIRTHDAY | NAME
SELECT * FROM T_NULL WHERE PRICE IS NULL;
3 | 30 | NULL | NULL | C
5 | NULL | NULL | NULL | NULL
ID | NUM | PRICE | BIRTHDAY | NAME
SELECT * FROM T_NULL WHERE PRICE IS NOT NULL;
1 | 10 | 9.9 | 2021-01-01 | A
2 | NULL | 8.8 | 2020-02-02 | B
4 | 40 | 4.4 | 2019-03-03 | NULL
6 | 0 | 0 | 2000-01-01 | ZERO
7 | 5 | 1.5 | NULL | NEG
ID | NUM | PRICE | BIRTHDAY | NAME
SELECT * FROM T_NULL WHERE BIRTHDAY IS NULL;
3 | 30 | NULL | NULL | C
5 | NULL | NULL | NULL | NULL
7 | 5 | 1.5 | NULL | NEG
ID | NUM | PRICE | BIRTHDAY | NAME
SELECT * FROM T_NULL WHERE BIRTHDAY IS NOT NULL;
1 | 10 | 9.9 | 2021-01-01 | A
2 | NULL | 8.8 | 2020-02-02 | B
4 | 40 | 4.4 | 2019-03-03 | NULL
6 | 0 | 0 | 2000-01-01 | ZERO
ID | NUM | PRICE | BIRTHDAY | NAME
SELECT * FROM T_NULL WHERE NAME IS NULL;
4 | 40 | 4.4 | 2019-03-03 | NULL
5 | NULL | NULL | NULL | NULL
ID | NUM | PRICE | BIRTHDAY | NAME
SELECT * FROM T_NULL WHERE NAME IS NOT NULL;
1 | 10 | 9.9 | 2021-01-01 | A
2 | NULL | 8.8 | 2020-02-02 | B
3 | 30 | NULL | NULL | C
6 | 0 | 0 | 2000-01-01 | ZERO
7 | 5 | 1.5 | NULL | NEG
ID | NUM | PRICE | BIRTHDAY | NAME

5. EQUALITY/INEQUALITY WITH NULL
SELECT * FROM T_NULL WHERE NUM = NULL;
ID | NUM | PRICE | BIRTHDAY | NAME
SELECT * FROM T_NULL WHERE NULL = NUM;
ID | NUM | PRICE | BIRTHDAY | NAME
SELECT * FROM T_NULL WHERE NUM <> NULL;
ID | NUM | PRICE | BIRTHDAY | NAME
SELECT * FROM T_NULL WHERE NULL <> NUM;
ID | NUM | PRICE | BIRTHDAY | NAME

6. COMPARISONS WHERE EXPRESSION MAY YIELD NULL
SELECT * FROM T_NULL WHERE NUM + 1 > 10;
SELECT * FROM T_NULL WHERE NUM * PRICE > 0;
SELECT * FROM T_NULL WHERE PRICE + 1 IS NULL;
SELECT * FROM T_NULL WHERE (NUM - 10) IS NULL;

7. BOOLEAN LOGIC WITH NULL
SELECT * FROM T_NULL WHERE NUM > 10 AND NUM IS NULL;
ID | NUM | PRICE | BIRTHDAY | NAME
SELECT * FROM T_NULL WHERE NUM > 0 AND PRICE IS NULL;
3 | 30 | NULL | NULL | C
ID | NUM | PRICE | BIRTHDAY | NAME

8. CROSS-TABLE COMPARISONS (NULL IN JOIN CONDITIONS)
SELECT T_NULL.ID,T_NULL.NUM,T_NULL2.ID,T_NULL2.NUM FROM T_NULL,T_NULL2 WHERE T_NULL.NUM = T_NULL2.NUM;
1 | 10 | 1 | 10
T_NULL.ID | T_NULL.NUM | T_NULL2.ID | T_NULL2.NUM

9. UPDATES INVOLVING NULL
UPDATE T_NULL SET NUM = NULL WHERE ID = 1;
SUCCESS
UPDATE T_NULL SET PRICE = 5.5 WHERE PRICE IS NULL; TODO: 查询时索引无法识别NULL，因为NULL != NULL
SUCCESS
UPDATE T_NULL SET NAME = NULL WHERE ID = 6;
SUCCESS
UPDATE T_NULL SET NUM = 100 WHERE NUM IS NOT NULL;
SUCCESS
UPDATE T_NULL SET PRICE = 9.9 WHERE PRICE IS NOT NULL; TODO: 查询时索引无法识别NULL，因为NULL != NULL
SUCCESS

9.1 SELECT AFTER UPDATES
SELECT * FROM T_NULL;
1 | NULL | 9.9 | 2021-01-01 | A
2 | NULL | 8.8 | 2020-02-02 | B
3 | 100 | NULL | NULL | C
4 | 100 | 4.4 | 2019-03-03 | NULL
5 | NULL | NULL | NULL | NULL
6 | 100 | 0 | 2000-01-01 | NULL
7 | 100 | 1.5 | NULL | NEG
ID | NUM | PRICE | BIRTHDAY | NAME

10. DELETES INVOLVING NULL
DELETE FROM T_NULL WHERE BIRTHDAY IS NULL; TODO: 查询时索引无法识别NULL，因为NULL != NULL
SUCCESS
SELECT AFTER DELETE
SELECT * FROM T_NULL;
1 | NULL | 9.9 | 2021-01-01 | A
2 | NULL | 8.8 | 2020-02-02 | B
3 | 100 | NULL | NULL | C
4 | 100 | 4.4 | 2019-03-03 | NULL
5 | NULL | NULL | NULL | NULL
6 | 100 | 0 | 2000-01-01 | NULL
7 | 100 | 1.5 | NULL | NEG
ID | NUM | PRICE | BIRTHDAY | NAME

11. COMBINATION OF PREDICATES WITH NULL IN WHERE
SELECT * FROM T_NULL WHERE NUM IS NULL AND PRICE IS NULL;
5 | NULL | NULL | NULL | NULL
ID | NUM | PRICE | BIRTHDAY | NAME
SELECT * FROM T_NULL WHERE NUM IS NULL AND NAME IS NULL;
5 | NULL | NULL | NULL | NULL
ID | NUM | PRICE | BIRTHDAY | NAME
UPDATE T_NULL SET BIRTHDAY = NULL WHERE ID = 4
SUCCESS
SELECT * FROM T_NULL WHERE BIRTHDAY IS NULL AND NAME IS NULL;
4 | 100 | 4.4 | NULL | NULL
5 | NULL | NULL | NULL | NULL
ID | NUM | PRICE | BIRTHDAY | NAME

12. INSERTING ROWS THAT ARE ALL NULL EXCEPT NOT NULL ID
INSERT INTO T_NULL VALUES (8, NULL, NULL, NULL, NULL);
SUCCESS

13. INSERTING INTO NOT-NULL COLUMN (SHOULD ERROR)
INSERT INTO T_NULL VALUES (NULL, 100, 10.0, '2022-01-01', 'Z');
FAILURE

14. CROSS-TABLE WHERE SECOND TABLE HAS NULL NUM
SELECT T_NULL.ID, T_NULL.NUM, T_NULL2.ID, T_NULL2.NUM FROM T_NULL, T_NULL2 WHERE T_NULL.NUM = T_NULL2.NUM;
T_NULL.ID | T_NULL.NUM | T_NULL2.ID | T_NULL2.NUM

15. UPDATE SELECT
UPDATE T_NULL SET NUM = (SELECT NUM FROM T_NULL2 WHERE ID =1) WHERE ID = 6;
SUCCESS
SELECT * FROM T_NULL;
1 | NULL | 9.9 | 2021-01-01 | A
2 | NULL | 8.8 | 2020-02-02 | B
3 | 100 | NULL | NULL | C
4 | 100 | 4.4 | NULL | NULL
5 | NULL | NULL | NULL | NULL
6 | 10 | 0 | 2000-01-01 | NULL
7 | 100 | 1.5 | NULL | NEG
8 | NULL | NULL | NULL | NULL
ID | NUM | PRICE | BIRTHDAY | NAME
UPDATE T_NULL SET NUM = (SELECT NUM FROM T_NULL2 WHERE ID =2) WHERE ID = 6;
SUCCESS
SELECT * FROM T_NULL;
1 | NULL | 9.9 | 2021-01-01 | A
2 | NULL | 8.8 | 2020-02-02 | B
3 | 100 | NULL | NULL | C
4 | 100 | 4.4 | NULL | NULL
5 | NULL | NULL | NULL | NULL
6 | NULL | 0 | 2000-01-01 | NULL
7 | 100 | 1.5 | NULL | NEG
8 | NULL | NULL | NULL | NULL
ID | NUM | PRICE | BIRTHDAY | NAME
UPDATE T_NULL SET NUM = (SELECT NUM FROM T_NULL2 WHERE ID =4) WHERE ID = 6; TODO: 查询时索引无法识别NULL，因为NULL != NULL
SELECT * FROM T_NULL;
1 | NULL | 9.9 | 2021-01-01 | A
2 | NULL | 8.8 | 2020-02-02 | B
3 | 100 | NULL | NULL | C
4 | 100 | 4.4 | NULL | NULL
5 | NULL | NULL | NULL | NULL
6 | NULL | 0 | 2000-01-01 | NULL
7 | 100 | 1.5 | NULL | NEG
8 | NULL | NULL | NULL | NULL
ID | NUM | PRICE | BIRTHDAY | NAME

16. UNIQUE
CREATE TABLE NULL_TABLE5(ID INT NULL, NUM INT NOT NULL);
SUCCESS
CREATE UNIQUE INDEX INDEX_ID ON NULL_TABLE5(ID);
SUCCESS
INSERT INTO NULL_TABLE5 VALUES(1,1);
SUCCESS
INSERT INTO NULL_TABLE5 VALUES(1,1);
FAILURE
INSERT INTO NULL_TABLE5 VALUES(NULL,2);
SUCCESS
INSERT INTO NULL_TABLE5 VALUES(NULL,2);
SUCCESS
