initialization
CREATE TABLE date_table(id int, u_date date);
SUCCESS
CREATE INDEX index_id on date_table(u_date);
SUCCESS

1. insert normal date data
INSERT INTO date_table VALUES (1,'2020-01-21');
SUCCESS
INSERT INTO date_table VALUES (2,'2020-10-21');
SUCCESS
INSERT INTO date_table VALUES (3,'2020-1-01');
SUCCESS
INSERT INTO date_table VALUES (4,'2020-01-1');
SUCCESS
INSERT INTO date_table VALUES (5,'2019-12-21');
SUCCESS
INSERT INTO date_table VALUES (6,'2016-2-29');
SUCCESS
INSERT INTO date_table VALUES (7,'1970-1-1');
SUCCESS
INSERT INTO date_table VALUES (8,'2000-01-01');
SUCCESS
INSERT INTO date_table VALUES (9,'2038-1-19');
SUCCESS

2. compare date data
SELECT * FROM date_table WHERE u_date>'2020-1-20';
1 | 2020-01-21
2 | 2020-10-21
9 | 2038-01-19
id | u_date
SELECT * FROM date_table WHERE u_date<'2019-12-31';
5 | 2019-12-21
6 | 2016-02-29
7 | 1970-01-01
8 | 2000-01-01
id | u_date
SELECT * FROM date_table WHERE u_date='2020-1-1';
3 | 2020-01-01
4 | 2020-01-01
id | u_date

3. not equal
SELECT * FROM date_table WHERE u_date<>'2000-01-01' and u_date < '2019-12-21';
6 | 2016-02-29
7 | 1970-01-01
id | u_date

4. delete data
DELETE FROM date_table WHERE u_date>'2012-2-29';
SUCCESS
SELECT * FROM date_table;
7 | 1970-01-01
8 | 2000-01-01
id | u_date

5. check invalid date data
SELECT * FROM date_table WHERE u_date='2017-2-29';
FAILURE
SELECT * FROM date_table WHERE u_date='2017-21-29';
FAILURE
SELECT * FROM date_table WHERE u_date='2017-12-32';
FAILURE
SELECT * FROM date_table WHERE u_date='2017-11-31';
FAILURE
INSERT INTO date_table VALUES (10,'2017-2-29');
FAILURE
INSERT INTO date_table VALUES (11,'2017-21-29');
FAILURE
INSERT INTO date_table VALUES (12,'2017-12-32');
FAILURE
INSERT INTO date_table VALUES (13,'2017-11-31');
FAILURE