CREATE TABLE table1(id INT, age INT);
SUCCESS
CREATE TABLE table2(id INT, name CHAR);
SUCCESS

INSERT INTO table1 VALUES(1,2);
SUCCESS
INSERT INTO table1 VALUES(3,4);
SUCCESS
INSERT INTO table2 VALUES(1,'A');
SUCCESS
INSERT INTO table2 VALUES(3,'B');
SUCCESS

create view v6 as select id, age, id+age as data from table1 where id in (select id from table2);
SUCCESS
select count(*) from v6;
2
count(*)
select count(id) from v6;
2
count(id)
select sum(data) from v6;
10
sum(data)
select count(name) from v6;
FAILURE

create view v8 as select id, data from v6;
SUCCESS
select * from v8;
1 | 3
3 | 7
id | data
insert into v8(id) values(9);
FAILURE
update v8 set data = 1;
FAILURE
update v8 set id = 1;
SUCCESS
select * from v8;
1 | 3
3 | 5
delete from v8 where data = 7;
FAILURE